company,report_title,date
아스트,B737 MAX 기종의 운항 재개 등으로 실적 회복..,21.04.23
동화기업,2차전지 전해액 사업 진출을 통한 신성장 동..,21.04.23
대모,생산 인프라 개선 및 전략적 제품군 개발로 ..,21.04.23
마니커에프앤지,"육가공 전문 기업, 종합식품 개발을 통한 글..",21.04.23
유성티엔에스,철강재 전문 종합물류기업,21.04.23
아이오케이,종합 엔터테인먼트 기업으로의 도약 시작,21.04.23
갤럭시아머니트리,종합 금융 플랫폼 전문기업,21.04.23
유에스티,금속 소재 기업에서 소재 전문 기업으로의 변..,21.04.23
기아,1Q 하회. 일시적 요인. SUV 빅사이클과 EV6에..,21.04.23
솔루스첨단소재,"시간이 필요 했던 조정, 이제 다시 미래를 겨..",21.04.23
현대차,체질개선 시작의 입증,21.04.23
기아,너무 높았던 실적의 기대감,21.04.23
LG생활건강,흔들리지 않는 편안함,21.04.23
현대차,"1분기 물량, 믹스 호조, 2분기도 기저효과 유..",21.04.23
KB금융,NIM 상승과 비은행의 힘,21.04.23
F&F,"MLB, 중국인의 마음을 저격하다",21.04.22
삼성생명,연이은 두 자리 수 개선 가능성 높다,21.04.22
우리금융지주,경상 수익성을 레벨업 시킨 top-line 개선,21.04.22
셀트리온헬스케어,렉키로나주 유럽정부와의 공급계약 체결 가능..,21.04.22
우리금융지주,핵심이익 증가와 비용감소로 호실적 시현,21.04.22
우리금융지주,수익 및 비용 모든 측면에서 기대이상,21.04.22
LG,분할은 변화의 시작,21.04.22
LG전자,VS로 높아지는 상방. 가전으로 지지되는 하방,21.04.21
매일유업,시장 기대 부합 전망,21.04.21
LG유플러스,"결국은 실적이 주가 올릴 것, 움직이면 상승 ..",21.04.21
한샘,21년 1분기 실적 가구 매출 성장에 힙입어 양..,21.04.21
한샘,한샘이 비싸지 않은 이유,21.04.21
더블유게임즈,한국 DDI 나스닥 상장 재추진. 목표주가 다소..,21.04.21
경동나비엔,박스권 돌파에 대한 자신감을 가져야 할 시기,21.04.21
동아에스티,새로운 인력 & 신약 파이프라인 개발 역량 강..,21.04.21
KT,이 주가가 오래 지속되긴 어렵다 ,21.04.20
한미반도체,"1Q21 잠정 실적, 예상 부합 ",21.04.20
SK머티리얼즈,하반기 소재의 시간은 온다,21.04.20
스튜디오드래곤,시장 컨센서스 소폭 상회 전망,21.04.20
한글과컴퓨터,자회사 한컴라이프케어 IPO로 지분가치 상승,21.04.20
한국가스공사,기다려지는 신사업 로드맵,21.04.19
한솔케미칼,탐방 노트,21.04.19
셀트리온,렉키로나주가 본격적으로 판매되면 큰 폭의 ..,21.04.19
넥센타이어,2021년 외형 회복 기대,21.04.19
디딤,프랜차이즈와 직영 사업으로 구성된 외식사업..,21.04.16
대유,"미량요소 복합비료 전문기업, 유기농업자재와..",21.04.16
릭스솔루션,SI NI 1세대 ICT 전문기업,21.04.16
덕우전자,전자기기 및 자동차 부품 분야 제조기업,21.04.16
SGC이테크건설,플랜트 및 토목건축공사 전문기업,21.04.16
엠에스오토텍,"핫스탬핑 기술의 선도주자, 전기차 부품으로..",21.04.16
성창오토텍,자동차용 공조부품 선도업체로 친환경 자동차..,21.04.16
아이스크림에듀,"에듀테크 선도기업, AI를 통해 진보된 에듀테..",21.04.16
오르비텍,원자력 관련 사업 및 항공기 정밀부품 제조 ..,21.04.16
영우디에스피,디스플레이 검사장비 기술 기반 신사업 분야 ..,21.04.16
드림시큐리티,"통합 보안솔루션 제공, 제품고도화 및 서비스..",21.04.16
대원산업,카니발 효과로 성장. 뛰어난 재무구조 보유,21.04.16
휠라홀딩스,‘FILA’는 살아있다,21.04.16
한온시스템,고평가 상태 지속 예상,21.04.16
CJ프레시웨이,턴어라운드 폭 기대감이 가장 클 한해,21.04.16
NH투자증권,불확실성 속의 실적개선,21.04.16
SK텔레콤,"주주의 승리, 최선은 아니지만 최악은 면했다..",21.04.15
한미약품,실적보다는 R&D 성과를 보고 평가하자 ,21.04.15
종근당,R&D 투자 증가는 미래를 위한 준비. 여전히 ..,21.04.15
카카오,"사업 호조, 호재 만발. TP 1 5 액분 기준 조..",21.04.15
DGB금융지주,견조한 실적흐름 지속 예상,21.04.15
디오,예상보다 빠른 실적 턴어라운드,21.04.15
SK텔레콤,판 새로 짠다,21.04.15
에이스침대,에이스침대 - 1Q21 Preview,21.04.15
티씨케이,미국 반도체 장비주와 주가 동반 상승,21.04.14
테크윙,1분기가 아쉽지만 정녕 달라지고 있다 ,21.04.14
동국제약,이번에도 변함없이 성장,21.04.14
F&F,다시 한번 서프라이즈,21.04.14
KT&G,편안한 매력,21.04.14
현대글로비스,그룹사의 핵심위치로 점차 발전,21.04.14
고영,오랜만에 실적개선의 신호탄 발사,21.04.13
지누스,2Q21부터 호재 주목 받을 것,21.04.13
DL이앤씨,"저평가 상태, 모멘텀 회복될 것",21.04.13
피에스케이,2년 전 분할 이후 환.골.탈.태,21.04.13
녹십자,"CMO 기대감에 치이고, 실적에 치이고",21.04.13
텔코웨어,2021년 이후 Core 가상화 솔루션 기대감,21.04.13
만도,견고한 이익 흐름 기대,21.04.13
BNK금융지주,1분기 호실적 예상. 21년 큰 폭의 이익성장 ..,21.04.13
아프리카TV,"플랫폼도 좋은데, 광고는 더 좋아진다",21.04.13
보령제약,항암제 사업의 성장성에 주목,21.04.13
이마트,21.3월 기존점 코멘트,21.04.12
포스코인터내셔널,실적 라운드와 EV 사업 확대,21.04.12
신세계푸드,"달라질 DNA, 내년부터 많이 좋아진다 ",21.04.12
덕산하이메탈,"중간지주사(X), 사업회사(O)",21.04.12
SK이노베이션,소송 불확실성 제거로 반등 가능 vs. 아직은 ..,21.04.12
현대차,이제는 위가 보인다,21.04.12
기아,이번에도 써프라이즈 기대,21.04.12
CJ제일제당,모든 면에서 좋다,21.04.12
LIG넥스원,첨단무기체계 강화에 따른 수주잔고 확대,21.04.12
지어소프트,"21년, 퀀텀 점프의 해",21.04.09
세경하이테크,스마트폰 특수필름 및 복합소재 가공 전문기..,21.04.09
KPX생명과학,정밀화학기술 기반 원료의약품(API) 개발 및 ..,21.04.09
인베니아,디스플레이 제조설비 전문기업,21.04.09
켐트로스,우수한 합성 및 배합기술로 특화된 첨단소재..,21.04.09
AP시스템,디스플레이 및 반도체 제조 장비 선도기업,21.04.09
기산텔레콤,"무선통신용 중계기 선도기업으로 항공, 방위..",21.04.09
다우데이타,IT 솔루션 공급 VAN PG 전문 핀테크 기업,21.04.09
비아트론,독보적 기술을 보유한 디스플레이용 장비 제..,21.04.09
BGF리테일,성수기가 목전이다,21.04.09
메리츠증권,꾸준한 실적과 강화된 주주친화정책,21.04.09
삼성전자,실적 성장과 밸류에이션 상향 임박,21.04.08
삼성전자,수요 양호한데 칩 부족 우려가 주가에 부담,21.04.08
일진머티리얼즈,Northvolt 공급 계약의 함의,21.04.08
DB하이텍,칩 공급 부족에 따른 수혜 재부각,21.04.08
삼성전자,"1분기는 IM, 이제는 메모리가 이끌 실적",21.04.08
펄어비스,올해 핵심 모멘텀은 붉은사막. 도깨비도 기대..,21.04.08
효성티앤씨,1분기 어닝 서프라이즈 기대,21.04.08
LS,매수해야 할 이유,21.04.08
삼성증권,리테일 강자,21.04.08
고려아연,금속가격 상승으로 양호한 1분기 영업실적 기..,21.04.07
풍산,실적 전망에 비해 과도한 주가 조정,21.04.07
해성디에스,"연간 매출액 상향, 하반기 수익성 개선 기대 ",21.04.07
넷마블,LT Buy는 유효. 단기적으론 신작일정별 사후 ..,21.04.07
우리금융지주,큰 폭의 수익성 개선 예상,21.04.07
에스엠,주가 바닥에서 지배구조 개편. 관심이 필요하..,21.04.07
현대글로비스,실적 회복 초입 국면,21.04.06
포스코인터내셔널,재평가된 주가도 여전히 매력적 ,21.04.06
현대건설,갈수록 좋아질 것 ,21.04.06
신세계인터내셔날,"높은 브랜드 MD, 강한 실적 턴어라운드",21.04.06
코메론,"Valuation 저평가, 줄자사업 성장 기대감",21.04.06
컴투스,1Q21 실적보단 서머너즈워 백년전쟁 흥행수준..,21.04.06
대우건설,성장성을 바로 확인하는 1분기,21.04.06
LG전자,MC사업부 드디어 철수 결정,21.04.06
엔씨소프트,블레이드앤소울2 모멘텀에 집중되는 시기,21.04.06
아모레퍼시픽,"회복, 그 이상을 보여주는 중",21.04.05
원익IPS,한파 완화되고 설비투자 기대감 회복 ,21.04.05
빅히트,글로벌 1위 기획사가 되었지만 이게 끝일까요,21.04.05
GS건설,실적 기대감은 2분기로,21.04.05
빅히트,"하이브, 태극기 휘날리며",21.04.05
팬오션,"실적, 결국 시황 호조를 따라간다",21.04.02
효성첨단소재,"1분기 영업이익, 작년 연간 수치의 2.2배 전..",21.04.02
동양생명,3이원 모두 양호한 금리 수혜주,21.04.02
HSD엔진,1분기 선박엔진 수주는 4천억원 상회 ,21.04.02
스튜디오드래곤,목표주가 상향 및 드라마 제작사 바스켓 매수,21.04.02
삼성전자,가격 상승에 초점을 맞추자,21.04.02
한국금융지주,2021년에도 역대 최고실적 전망,21.04.02
SK하이닉스,하반기 메모리 수요의 연속성 기대,21.04.01
삼성전자,하반기 반도체 부문 매력도 부각,21.04.01
메드팩토,신약으로 향하는 우상향 궤적,21.04.01
코오롱인더,없어서 못 팔고 있다,21.04.01
아시아종묘,육종 및 생명공학 연구를 기반으로 한 종자 ..,21.04.01
수젠텍,체외진단 전문기업,21.04.01
웰크론,고기능성 섬유 제품 전문기업,21.04.01
텔레칩스,지능형 차량용 반도체 팹리스 핵심기술 보유 ..,21.04.01
유니온커뮤니티,생체인식 솔루션 전문기업,21.04.01
파인디앤씨,정밀금형 기술 기반 글로벌 부품소재 전문기..,21.04.01
에이트원,가상현실(VR)·증강현실(AR) 전문기업,21.04.01
빅솔론,"산업용 소형 프린터 분야, 글로벌 선도 기업",21.04.01
한전KPS,올해 이익 회복의 첫 단추,21.04.01
한화생명,1분기 손익만큼은 상당히 괜찮을 것 ,21.04.01
정상제이엘에스,오프라인 학원 고성장 기대 배당수익률 6.6%,21.04.01
덕산네오룩스,최근 주가 조정은 비중확대의 기회,21.03.31
휴켐스,서당 개 삼 년에 풍월을 읊는다,21.03.31
연우,돌아서는 폭이 남다르다,21.03.31
CJ제일제당,시장 기대 부합 전망,21.03.31
엔씨소프트,리니지2 M 일본 대만이 언제 기대일정이었나 ..,21.03.31
NICE평가정보,개인 CB(Credit Bureau)의 추세적인 성장,21.03.31
한화솔루션,사람이 독해졌다,21.03.30
SKC,폭풍전야,21.03.30
SK텔레콤,중요한 건 SK(주)와의 합병 여부 아닐까요,21.03.30
HSD엔진,수에즈 운하 정체는 LNG추진선 수요 성장의 ..,21.03.30
NAVER,손익 가치 다소 하향보다 커머스 부문 가치 ..,21.03.30
한샘,인테리어는 필수인 시대,21.03.30
알톤스포츠,"2020년 턴어라운드, 2021년 성장 지속",21.03.29
금호석유,태세 전환,21.03.29
테크윙,연초 대비 주가 부진해 오히려 기회 ,21.03.29
금호석유,대세 상승 사이클 도래. Conviction BUY,21.03.29
셀트리온,렉키로나주 유럽에서 조건부허가 획득 ,21.03.29
코리아에프티,LCA 규제 수혜 및 글로벌 수주 확대,21.03.29
지노믹트리,국내 검진 확대 및 중국 본계약 기대,21.03.26
대한유화,ITC 소송 승리,21.03.26
현대제철,대규모 턴어라운드 기대,21.03.26
RFHIC,"기사회생, 대삼성 수주 증가로 주가 오를 것",21.03.26
오스코텍,2분기부터 오스코텍 저점매수,21.03.26
LG상사,생각보다 훨씬 더 좋을지도,21.03.26
LG생활건강,중국 소비 회복 기대,21.03.26
KB금융,1분기 높은 이익증가율 전망,21.03.26
CJ대한통운,예상보다 큰 단가 인상 폭,21.03.25
LG화학,충분히 빠졌다. 포지션 확대를 고려할 시기,21.03.25
효성티앤씨,"1분기 영업이익, 작년 연간 수치의 70% 상회 ..",21.03.25
골프존,스크린골프 선도기업,21.03.25
홈센타홀딩스,"유상증자를 통한 시설투자, 차입금 상환으로 ..",21.03.25
메드팩토,암종과 무관하게 특정 바이오마커를 가진 환..,21.03.25
녹십자웰빙,다양한 제품군을 보유한 전문의약품 제조·판..,21.03.25
삼기,알루미늄 주물을 이용한 자동차 부품 제조 전..,21.03.25
상지카일룸,상위 1%를 위한 고급 주택 건설에 특화된 부..,21.03.25
에스제이그룹,"글로벌 패션브랜드, 제품기획력을 통한 경쟁..",21.03.25
투비소프트,"UI UX 솔루션 전문 기업, 비대면 서비스 수요..",21.03.25
링네트,네트워크 통신 솔루션 전문기업,21.03.25
라온시큐어,보안업체가 확장성을 가진다면,21.03.25
유니셈,ESG 기대감 소화 후 실적주로 재부각 ,21.03.25
신한지주,분기 배당 기대. 다만 실제 현실화 시기는 20..,21.03.25
쌍용양회,"눈앞으로 다가온 건설투자 Cycle, 시멘트 대..",21.03.25
한국철강,2분기를 기점으로 올해 큰 폭의 영업실적 개..,21.03.25
테스나,카메라 이미지 센서 증설 공시 시사점 ,21.03.25
마이크로디지탈,바이오 산업 대표 소부장을 찾아라,21.03.25
LS전선아시아,기대해도 좋을 조짐들,21.03.25
현대해상,보험영업 중심의 수익성 강화를 통한 2021년 ..,21.03.24
한화손해보험,"올해에도 실적 개선 지속 전망, 이에 목표주..",21.03.24
이마트,기대할 것이 많다,21.03.24
코미코,2021년에는 국내에서 선방할 듯,21.03.24
HSD엔진,전세계 메이저 언론은 선박연료 변화를 주목,21.03.24
효성첨단소재,여전히 저평가 되어 있다,21.03.24
라이프시맨틱스,의료서비스 제공 주체와 수요자의 정보격차 ..,21.03.23
케이엠더블유,"호재 많아지는 국면, 장기 적극 매수 추천 ",21.03.23
KT,주총 이후 배당 및 자회사 가치 부상 전망,21.03.23
아이씨디,하반기 글로벌 OLED 투자 재개 기대,21.03.22
실리콘웍스,"넓어지는 운신의 폭, 목표주가 상향",21.03.22
이녹스첨단소재,OLED로의 사업 구조 전환 지속,21.03.22
DGB금융지주,"양호한 이익 성장, 주가 재평가 지속 전망",21.03.22
KB금융,업종 대표주 프리미엄을 향유하자,21.03.22
엘비세미콘,연간 실적 점검 및 전망 ,21.03.22
LG이노텍,이쯤되면 리레이팅 해줘야죠,21.03.22
효성중공업,실적 개선 전망과 저탄소 체제 가속화,21.03.22
삼성카드,"안정적인 이익, 배당 성장 기대",21.03.19
JYP Ent.,어김없이 탄탄한 실적,21.03.19
한솔인티큐브,비즈니스 커뮤니케이션 솔루션 선도기업,21.03.19
코세스,"반도체 및 디스플레이 제조장비 전문업체, 전..",21.03.19
SG&G,"물류, 자동차부품 등 다양한 사업을 영위하는..",21.03.19
코맥스,스마트홈 솔루션 기술 보유,21.03.19
에쎈테크,황동 밸브 부품 개발 및 제조 Specialist,21.03.19
이글벳,오랜 기술 노하우를 보유한 Animal Health Ca..,21.03.19
SDN,국내외 태양광발전 보급 정책에 따른 긍정적..,21.03.19
동진쎄미켐,차별화된 첨단소재기술을 바탕으로 정밀화학 ..,21.03.19
잉크테크,잉크젯 활용기술을 기반으로 한 디지털 프린..,21.03.19
우양,식품의 신선함을 유지한 HMR을 생산하는 전문..,21.03.19
이노인스트루먼트,광통신 인프라 구축용 광섬유 융착접속기 수..,21.03.19
야스,대형 패널용 장비 양산 경험을 보유한 OLED ..,21.03.19
퓨쳐스트림네트웍스,통합 디지털 마케팅을 구현하는 종합광고대행..,21.03.19
프로스테믹스,줄기세포 추출성분을 활용한 화장품·의약품 ..,21.03.19
아스타,차세대 진단 시스템을 개발하는 바이오 벤처..,21.03.19
나이벡,"바이오 전문기업, 펩타이드 기반의 의약품 및..",21.03.19
케이엔제이,"디스플레이 장비 전문기업, CVD-SiC 기술기반..",21.03.19
이노메트리,X-ray 2차전지 검사장비 및 제조장비 전문기..,21.03.19
에스에스알,취약점 진단 선도기업,21.03.19
파워넷,전력전자 설계 및 생산 공정기술 기반의 전원..,21.03.19
예스티,반도체 산업의 설비 투자 회복 전망으로 실적..,21.03.19
그리티,다양한 컨셉의 브랜드 포트폴리오 보유 및 다..,21.03.19
에버다임,"국내 건설기계 및 특장차 분야 전문기업, 군 ..",21.03.19
이트론,국산 서버 시장의 선두기업,21.03.19
롯데케미칼,실적 서프라이즈로 정상궤도 진입을 고함,21.03.19
월덱스,연간 실적 점검 및 전망,21.03.19
다나와,사업영역 다각화 PC부품 유통 강화,21.03.19
동국제약,전문의약품 사업의 경쟁력 강화될 듯,21.03.19
CJ제일제당,역기저 부담에도 1분기 양호한 실적 전망,21.03.19
인터로조,2021년 부진 딛고 재도약,21.03.18
에스엘,하반기 이후 실적 개선 본격화 기대,21.03.18
NAVER,글로벌 이커머스 기업을 위한 뚜렷한 청사진 ..,21.03.18
엔비티,난리났네 난리났어 ,21.03.18
OCI,약점 없는 단기 시황 vs. 중장기 경쟁력 ,21.03.18
코스맥스엔비티,보릿고개를 넘기다,21.03.18
빙그레,해태아이스크림 품고 매출 1조클럽 가입 전망,21.03.18
대원제약,다시 예년의 성장세로 복귀,21.03.18
지어소프트,변함없는 라이징 스타,21.03.17
카카오,비트코인 열풍 최대 수혜주는 카카오,21.03.17
코오롱플라스틱,"올해 1분기 영업이익, 작년 대비 321.3% 증가..",21.03.17
롯데정밀화학,롯데그룹 스페셜티 수소 사업의 시작점이 될 ..,21.03.17
SKC,"상반기는 화학, 하반기는 동박",21.03.17
DGB금융지주,건전성 개선으로 충당금 추가 감소 효과 예상..,21.03.17
SK머티리얼즈,주가의 걸림돌이 작아졌다 ,21.03.17
티씨케이,"연간 영업이익 1,000억 원 가시화 ",21.03.17
루트로닉,숫자로 증명한 성장성과 수익성,21.03.17
씨젠,유럽과 브라질에서 다시 확진자 증가 ,21.03.16
POSCO,공격적인 가격인상의 반영으로 큰 폭의 실적..,21.03.16
DL이앤씨,"민간 주택공급 확대 가능성, 할인률 축소 요..",21.03.16
엔씨소프트,해외 진출 성공에 따른 기업가치 상승 전망,21.03.16
효성첨단소재,"올해 1분기, 재차 어닝 서프라이즈 전망",21.03.15
메디톡스,실적 개선은 2분기부터 가능 ,21.03.15
효성화학,1Q21부터 서프라이즈. 중장기 높은 투자수익..,21.03.15
아세아제지,골판지 황금시대의 선두주자,21.03.15
키다리스튜디오,순항 중인 글로벌 웹툰 플랫폼,21.03.12
씨앤투스성진,필터 소재 경쟁력을 바탕으로 관련사업확대 ..,21.03.12
삼성전기,순항 중인 MLCC,21.03.12
삼천당제약,"안과용제 전문기업, 신규 파이프라인 확보하..",21.03.12
코윈테크,2차전지 생산 공정에 특화된 자동화 시스템 ..,21.03.12
이엘피,디스플레이 검사장비 제조 전문기업,21.03.12
힘스,"OLED 공정장비 제조 전문기업, 해외 수출 확..",21.03.12
이라이콤,"국내 BLU 분야 전문기업, 반도체 장비제조업..",21.03.12
코엔텍,폐기물 처리 전문기업으로 신규 매립지 조성..,21.03.12
코이즈,"디스플레이 광학소재 전문기업, 신성장 동력 ..",21.03.12
쎄미시스코,"디스플레이 검사장비 전문기업, 신사업 초소..",21.03.12
아진산업,혁신적인 기술과 품질을 보유한 자동차 부품 ..,21.03.12
덱스터,VFX(시각 특수효과) 기술 및 콘텐츠 전문기업,21.03.12
시그네틱스,국내 최초 반도체 어셈블리 및 테스트 전문기..,21.03.12
대한과학,"연구용 실험기기와 의료기기 전문기업, 글로..",21.03.12
오리온,1분기 실적 장세의 대안,21.03.12
에스엠,메타버스 이전에 실적 좀,21.03.12
이마트,코로나 19 속 구 정 특 수 반 영하며 턴 어라..,21.03.12
파트론,신규 사업에 대한 기대감 유효,21.03.11
삼천리자전거,시장 트렌드 변화를 실적으로 증명하는 한 해,21.03.11
삼성SDI,비수기를 기회로 ,21.03.11
POSCO,3월 10 일 포스코 주가 하락 관련 코멘트,21.03.11
이마트,이마트는 네이버와 무엇을 할 수 있을까,21.03.10
S-Oil,"1분기 영업이익, 시장 기대치 크게 상회 전망",21.03.10
LG이노텍,비수기를 잊다,21.03.10
하이트진로,‘사회적 거리두기’가 완화된다면… ,21.03.10
한라,다시 만난 실적 성장기,21.03.10
미래에셋생명,아쉬움은 조금 남지만 비관적인 내용 없음 ,21.03.10
대양전기공업,조선부문도 성장에 동참,21.03.10
화승엔터프라이즈,다시 전진,21.03.10
현대차,UAM 진출 신호탄이 울리다,21.03.10
